{
  "v": 1,
  "tid": "example-001",
  "h": "0f0e0d0c0b0a0908",
  "ha": "sha256",
  "b": [
    [
      "t1",
      0,
      "a1b2c3d4",
      "Example Page Title"
    ],
    [
      "p1",
      2,
      "b2c3d4e5",
      "This is an example paragraph with a typo teh."
    ],
    [
      "b1",
      20,
      "c3d4e5f6",
      "Home > Section > Page"
    ]
  ]
}
